{
  "apiVersion": "modos.pleiades/v1alpha1",
  "authority": {
    "canonicalMutationApplied": false,
    "ceiling": "none",
    "promotionTransactionRequired": true
  },
  "bindings": {
    "branch": "ontology/proposal-compiler-boundary-v1",
    "candidateSnapshotDigest": "sha256:fb24a0a0c1394fc8f4a45df9e68eb5d8ed9a3e849882c19ff0b743ffd8202196",
    "closureReceiptDigest": "sha256:7e4bc0216488af205339cc0a59b1eb4de5bc435be46d1e9b8dbb7aa263b64487",
    "commitSha": "18503ad22e01c1ab2461b4397fa9c5052ed121c3",
    "mindId": "mind:pleiades",
    "repository": "Zheke32174/pleiades",
    "schemaVersion": "v1alpha1",
    "semanticDiffDigest": "sha256:dab46271705556cb4572afbad2f54c8639aa26e4970aed8dbdaed7be149655bf",
    "sourceManifestDigest": "sha256:80e975416d93e2935f12f041c338ec8cc2dd49de5cab43b58a3b40b00f5d60f8",
    "sourceSnapshotDigest": "sha256:6cdb735ccdd132b7c86a7f60df6f953138f3555bfc362708947f7a8f5832ea51"
  },
  "blockers": [
    "github:Zheke32174/pleiades#42"
  ],
  "candidateId": "promotion-candidate:ontology-pr-52-0001",
  "checks": [
    {
      "name": "candidate-snapshot-digest-bound",
      "status": "pass"
    },
    {
      "name": "source-snapshot-digest-bound",
      "status": "pass"
    },
    {
      "name": "closure-receipt-digest-bound",
      "status": "pass"
    },
    {
      "name": "source-manifest-digest-bound",
      "status": "pass"
    },
    {
      "name": "semantic-diff-digest-bound",
      "status": "pass"
    },
    {
      "name": "repository-branch-commit-bound",
      "status": "pass"
    },
    {
      "name": "mind-schema-bound",
      "status": "pass"
    },
    {
      "name": "codeowners-evidence-present",
      "status": "pass"
    },
    {
      "detail": "github:Zheke32174/pleiades#42",
      "name": "no-unresolved-blocking-issues",
      "status": "blocked"
    },
    {
      "name": "closure-receipt-closed",
      "status": "pass"
    },
    {
      "name": "all-closure-checks-pass",
      "status": "pass"
    },
    {
      "name": "authority-remains-none",
      "status": "pass"
    },
    {
      "name": "signed-promotion-transaction-still-required",
      "status": "pass"
    }
  ],
  "kind": "OntologyPromotionGateReport",
  "status": "blocked"
}
